{
  "manifestSchemaVersion": "1.0.0",
  "manifestKind": "gcg.asset-pipeline.manifest",
  "common": {
    "manifestId": "fixture.ui-toolkit.valid.v1",
    "displayName": "Fixture Valid UI Toolkit Manifest",
    "governanceScope": "shared-cross-game",
    "source": {
      "repository": "Ghostcheese-Games/example",
      "relativeRoot": "Assets/UI"
    },
    "assets": [
      {
        "assetId": "main-menu-root",
        "path": "Layout/MainMenu.uxml",
        "kind": "ui-layout"
      }
    ]
  },
  "pipeline": {
    "family": "ui-toolkit-graphics",
    "familySchemaVersion": "1.0.0",
    "payload": {
      "visualTreeAssets": [
        "Layout/MainMenu.uxml"
      ]
    }
  }
}
